,Ticker,Company,Sector,Industry,Country,Market Cap,P/E,Price,Change,Volume
1425,QUS,SPDR MSCI USA StrategicFactors ETF,Financial,Exchange Traded Fund,USA,,,114.29,0.0064,18343.0
1426,QVAL,Alpha Architect U.S. Quantitative Value ETF,Financial,Exchange Traded Fund,USA,,,33.15,0.009899999999999999,9264.0
1427,QYLD,Global X NASDAQ 100 Covered Call ETF,Financial,Exchange Traded Fund,USA,,,22.83,0.0009,1448261.0
1428,QYLG,Global X Nasdaq 100 Covered Call & Growth ETF,Financial,Exchange Traded Fund,USA,,,30.85,0.0011,4551.0
1429,RAAX,VanEck Vectors Real Asset Allocation ETF,Financial,Exchange Traded Fund,USA,,,24.25,-0.0039000000000000003,6873.0
1430,RAFE,PIMCO RAFI ESG U.S. ETF PIMCO RAFI ESG U.S. ETF,Financial,Exchange Traded Fund,USA,,,29.81,0.0066,22.0
1431,RAVI,FlexShares Ready Access Variable Income Fund,Financial,Exchange Traded Fund,USA,,,76.15,-0.0002,10956.0
1432,RBUS,Nationwide Risk-Based U.S. Equity ETF,Financial,Exchange Traded Fund,USA,,,36.73,0.0039000000000000003,42.0
1433,RCD,Invesco S&P 500 Equal Weight Consumer Discretionary ETF,Financial,Exchange Traded Fund,USA,,,146.91,0.0109,27526.0
1434,RDIV,Invesco S&P Ultra Dividend Revenue ETF,Financial,Exchange Traded Fund,USA,,,40.13,0.0045000000000000005,65699.0
1435,RDOG,ALPS REIT Dividend Dogs ETF,Financial,Exchange Traded Fund,USA,,,44.98,-0.003,1628.0
1436,RDVY,First Trust Rising Dividend Achievers ETF,Financial,Exchange Traded Fund,USA,,,47.2,0.006999999999999999,1030499.0
1437,REET,iShares Global REIT ETF,Financial,Exchange Traded Fund,USA,,,26.09,-0.0011,630065.0
1438,REGL,ProShares S&P MidCap 400 Dividend Aristocrats ETF,Financial,Exchange Traded Fund,USA,,,70.81,0.0025,33971.0
1439,REIT,ALPS Active REIT ETF,Financial,Exchange Traded Fund,USA,,,26.83,0.0379,2839.0
1440,REK,ProShares Short Real Estate,Financial,Exchange Traded Fund,USA,,,10.24,-0.0005,2709.0
1441,REM,iShares Mortgage Real Estate Capped ETF,Financial,Exchange Traded Fund,USA,,,35.58,-0.0031,579594.0
1442,REML,Credit Suisse X-Links Monthly Pay 2xLeveraged Mortgage REIT ETN,Financial,Exchange Traded Fund,USA,,,7.03,0.0,724989.0
1443,REMX,VanEck Vectors Rare Earth/Strategic Metals ETF,Financial,Exchange Traded Fund,USA,,,77.43,-0.0018,88017.0
1444,RESD,WisdomTree International ESG Fund,Financial,Exchange Traded Fund,USA,,,30.35,0.0046,5932.0
1445,RESE,WisdomTree Emerging Markets ESG Fund,Financial,Exchange Traded Fund,USA,,,38.01,-0.0091,1347.0
1446,RESP,WisdomTree U.S. ESG Fund,Financial,Exchange Traded Fund,USA,,,45.37,0.0084,1360.0
1447,RETL,Direxion Daily Retail Bull 3X Shares,Financial,Exchange Traded Fund,USA,,,214.8,0.0451,38709.0
1448,REW,ProShares UltraShort Technology,Financial,Exchange Traded Fund,USA,,,11.04,-0.0173,25753.0
1449,REZ,iShares Residential and Multisector Real Estate ETF,Financial,Exchange Traded Fund,USA,,,75.84,-0.0021,21346.0
1450,RFCI,RiverFront Dynamic Core Income ETF,Financial,Exchange Traded Fund,USA,,,25.3,-0.0012,1918.0
1451,RFDA,RiverFront Dynamic US Dividend Advantage ETF,Financial,Exchange Traded Fund,USA,,,41.94,0.0070999999999999995,1866.0
1452,RFDI,First Trust RiverFront Dynamic Developed International ETF,Financial,Exchange Traded Fund,USA,,,67.82,0.0040999999999999995,2023.0
1453,RFEM,First Trust RiverFront Dynamic Emerging Markets ETF,Financial,Exchange Traded Fund,USA,,,73.31,-0.011699999999999999,731.0
1454,RFFC,RiverFront Dynamic US Flex-Cap ETF,Financial,Exchange Traded Fund,USA,,,42.67,0.008,2616.0
1455,RFG,Invesco S&P MidCap 400 Pure Growth ETF,Financial,Exchange Traded Fund,USA,,,225.08,0.0032,4796.0
1456,RFV,Invesco S&P MidCap 400 Pure Value ETF,Financial,Exchange Traded Fund,USA,,,91.93,0.0064,10929.0
1457,RGI,Invesco S&P 500 Equal Weight Industrials ETF,Financial,Exchange Traded Fund,USA,,,181.51,0.0088,11570.0
1458,RHS,Invesco S&P 500 Equal Weight Consumer Staples ETF,Financial,Exchange Traded Fund,USA,,,158.49,-0.0044,8432.0
1459,RIGS,RiverFront Strategic Income Fund,Financial,Exchange Traded Fund,USA,,,24.75,-0.0004,15475.0
1460,RINF,ProShares Inflation Expectations ETF,Financial,Exchange Traded Fund,USA,,,28.8,-0.008199999999999999,5575.0
1461,RING,iShares MSCI Global Gold Miners ETF,Financial,Exchange Traded Fund,USA,,,28.98,0.0007000000000000001,115843.0
1462,RJA,ELEMENTS Rogers Intl Commodity Agriculture TR ETN,Financial,Exchange Traded Fund,USA,,,7.03,-0.0007000000000000001,43505.0
1463,RJI,ELEMENTS Rogers Intl Commodity TR ETN,Financial,Exchange Traded Fund,USA,,,5.54,-0.0036,67551.0
1464,RJN,ELEMENTS Rogers Intl Commodity Energy TR ETN,Financial,Exchange Traded Fund,USA,,,1.94,-0.0102,535.0
1465,RLY,SPDR SSgA Multi-Asset Real Return ETF,Financial,Exchange Traded Fund,USA,,,26.96,-0.0015,14758.0
1466,RNDM,First Trust Developed International Equity Select ETF,Financial,Exchange Traded Fund,USA,,,54.62,0.0014000000000000002,652.0
1467,RNDV,First Trust US Equity Dividend Select ETF,Financial,Exchange Traded Fund,USA,,,28.66,0.005600000000000001,1599.0
1468,RNLC,First Trust Large Cap US Equity Select ETF,Financial,Exchange Traded Fund,USA,,,31.1,0.006,16025.0
1469,RNMC,First Trust Mid Cap US Equity Select ETF,Financial,Exchange Traded Fund,USA,,,28.38,0.0016,39539.0
1470,RNRG,Global X Renewable Energy Producers ETF,Financial,Exchange Traded Fund,USA,,,15.95,0.0,41556.0
1471,RNSC,First Trust Small Cap US Equity Select ETF,Financial,Exchange Traded Fund,USA,,,28.59,0.0006,88279.0
1472,ROAM,Hartford Multifactor Emerging Markets ETF,Financial,Exchange Traded Fund,USA,,,24.39,-0.0064,6856.0
1473,ROBO,Robo Global Robotics and Automation Index ETF,Financial,Exchange Traded Fund,USA,,,65.72,0.004699999999999999,154100.0
1474,ROBT,First Trust Nasdaq Artificial Intelligence and Robotics ETF,Financial,Exchange Traded Fund,USA,,,53.81,0.003,18506.0
1475,RODM,Hartford Multifactor Developed Markets (ex-US) ETF,Financial,Exchange Traded Fund,USA,,,30.36,0.0013,176179.0
1476,ROKT,SPDR Kensho Final Frontiers ETF,Financial,Exchange Traded Fund,USA,,,41.28,0.0022,6270.0
1477,ROM,ProShares Ultra Technology,Financial,Exchange Traded Fund,USA,,,86.19,0.0151,179555.0
1478,ROMO,Strategy Shares Newfound/ReSolve Robust Momentum ETF,Financial,Exchange Traded Fund,USA,,,27.0,0.0043,241.0
1479,ROOF,IQ U.S. Real Estate Small Cap ETF,Financial,Exchange Traded Fund,USA,,,24.5,-0.0044,7488.0
1480,RORO,ATAC US Rotation ETF,Financial,Exchange Traded Fund,USA,,,23.21,0.0060999999999999995,9508.0
1481,ROUS,Hartford Multifactor US Equity ETF,Financial,Exchange Traded Fund,USA,,,38.81,0.0054,16253.0
1482,RPAR,RPAR Risk Parity ETF,Financial,Exchange Traded Fund,USA,,,23.01,-0.005600000000000001,175748.0
1483,RPG,Invesco S&P 500 Pure Growth ETF,Financial,Exchange Traded Fund,USA,,,172.54,0.0070999999999999995,35310.0
1484,RPV,Invesco S&P 500 Pure Value ETF,Financial,Exchange Traded Fund,USA,,,74.94,0.006,701725.0
1485,RSP,Invesco S&P 500 Equal Weight ETF,Financial,Exchange Traded Fund,USA,,,145.13,0.0058,2339454.0
1486,RSX,VanEck Vectors Russia ETF,Financial,Exchange Traded Fund,USA,,,25.0,-0.0115,3636783.0
1487,RSXJ,VanEck Vectors Russia Small-Cap ETF,Financial,Exchange Traded Fund,USA,,,35.81,-0.006,3306.0
1488,RTH,VanEck Vectors Retail ETF,Financial,Exchange Traded Fund,USA,,,171.44,0.0102,28803.0
1489,RTM,Invesco S&P 500 Equal Weight Materials ETF,Financial,Exchange Traded Fund,USA,,,157.98,0.0098,12627.0
1490,RUSL,Direxion Daily Russia Bull 2X Shares,Financial,Exchange Traded Fund,USA,,,22.28,-0.0202,102606.0
1491,RVNU,Xtrackers Municipal Infrastructure Revenue Bond ETF,Financial,Exchange Traded Fund,USA,,,29.07,0.0016,14922.0
1492,RVRS,Reverse Cap Weighted U.S. Large Cap ETF,Financial,Exchange Traded Fund,USA,,,22.13,0.0051,9000.0
1493,RWGV,Direxion Russell 1000 Growth Over Value ETF,Financial,Exchange Traded Fund,USA,,,107.56,0.0115,1275.0
1494,RWJ,Invesco S&P SmallCap 600 Revenue ETF,Financial,Exchange Traded Fund,USA,,,115.02,0.004699999999999999,100785.0
1495,RWK,Invesco S&P MidCap 400 Revenue ETF,Financial,Exchange Traded Fund,USA,,,87.62,0.0077,10967.0
1496,RWL,Invesco S&P 500 Revenue ETF,Financial,Exchange Traded Fund,USA,,,71.19,0.0075,50189.0
1497,RWM,ProShares Short Russell2000,Financial,Exchange Traded Fund,USA,,,21.87,0.0005,902853.0
1498,RWO,SPDR Dow Jones Global Real Estate ETF,Financial,Exchange Traded Fund,USA,,,48.29,-0.0027,105319.0
1499,RWR,SPDR Dow Jones REIT ETF,Financial,Exchange Traded Fund,USA,,,96.86,-0.0002,72611.0
1500,RWVG,Direxion Russell 1000 Value Over Growth ETF,Financial,Exchange Traded Fund,USA,,,57.47,0.0037,5613.0
1501,RWX,SPDR Dow Jones International Real Estate ETF,Financial,Exchange Traded Fund,USA,,,35.32,-0.0031,454814.0
1502,RXD,ProShares UltraShort Health Care,Financial,Exchange Traded Fund,USA,,,8.84,0.0,0.0
1503,RXI,iShares Global Consumer Discretionary ETF,Financial,Exchange Traded Fund,USA,,,168.43,0.0046,7660.0
1504,RXL,ProShares Ultra Health Care,Financial,Exchange Traded Fund,USA,,,81.27,0.0219,4007.0
1505,RYE,Invesco S&P 500 Equal Weight Energy ETF,Financial,Exchange Traded Fund,USA,,,39.49,-0.0095,50719.0
1506,RYF,Invesco S&P 500 Equal Weight Financials ETF,Financial,Exchange Traded Fund,USA,,,57.56,0.01,94839.0
1507,RYH,Invesco S&P 500 Equal Weight Health Care ETF,Financial,Exchange Traded Fund,USA,,,272.4,0.011399999999999999,5705.0
1508,RYJ,Invesco Raymond James SB-1 Equity ETF,Financial,Exchange Traded Fund,USA,,,59.07,0.0037,469.0
1509,RYLD,Global X Russell 2000 Covered Call ETF,Financial,Exchange Traded Fund,USA,,,24.6,0.002,105991.0
1510,RYT,Invesco S&P 500 Equal Weight Technology ETF,Financial,Exchange Traded Fund,USA,,,281.96,0.0038,20019.0
1511,RYU,Invesco S&P 500 Equal Weight Utilities ETF,Financial,Exchange Traded Fund,USA,,,104.39,-0.0011,10615.0
1512,RZG,Invesco S&P SmallCap 600 Pure Growth ETF,Financial,Exchange Traded Fund,USA,,,158.89,0.0019,2864.0
1513,RZV,Invesco S&P SmallCap 600 Pure Value ETF,Financial,Exchange Traded Fund,USA,,,88.57,0.0045000000000000005,28110.0
1514,SBB,ProShares Short SmallCap600,Financial,Exchange Traded Fund,USA,,,17.99,-0.002,423.0
1515,SBIO,ALPS Medical Breakthroughs ETF,Financial,Exchange Traded Fund,USA,,,47.47,-0.019,24931.0
1516,SCHA,Schwab U.S. Small-Cap ETF,Financial,Exchange Traded Fund,USA,,,101.03,0.0021,382626.0
1517,SCHB,Schwab U.S. Broad Market ETF,Financial,Exchange Traded Fund,USA,,,100.15,0.006,387627.0
1518,SCHC,Schwab International Small-Cap Equity ETF,Financial,Exchange Traded Fund,USA,,,40.89,0.0032,245796.0
1519,SCHD,Schwab U.S. Dividend Equity ETF,Financial,Exchange Traded Fund,USA,,,74.26,0.005699999999999999,1748706.0
1520,SCHE,Schwab Emerging Markets Equity ETF,Financial,Exchange Traded Fund,USA,,,31.83,-0.008100000000000001,1128802.0
1521,SCHF,Schwab International Equity ETF,Financial,Exchange Traded Fund,USA,,,38.69,0.0023,1683924.0
1522,SCHG,Schwab U.S. Large-Cap Growth ETF,Financial,Exchange Traded Fund,USA,,,137.98,0.0089,388870.0
1523,SCHH,Schwab U.S. REIT ETF,Financial,Exchange Traded Fund,USA,,,41.99,-0.0012,301439.0
1524,SCHI,Schwab 5-10 Year Corporate Bond ETF,Financial,Exchange Traded Fund,USA,,,51.62,-0.0012,45002.0
1525,SCHJ,Schwab 1-5 Year Corporate Bond ETF,Financial,Exchange Traded Fund,USA,,,51.02,-0.0006,87441.0
1526,SCHK,Schwab 1000 ETF,Financial,Exchange Traded Fund,USA,,,40.93,0.0066,251127.0
1527,SCHM,Schwab U.S. Mid-Cap ETF,Financial,Exchange Traded Fund,USA,,,76.32,0.0040999999999999995,240226.0
1528,SCHO,Schwab Short-Term U.S. Treasury ETF,Financial,Exchange Traded Fund,USA,,,51.29,-0.0002,794370.0
1529,SCHP,Schwab U.S. TIPS ETF,Financial,Exchange Traded Fund,USA,,,61.13,-0.0018,2653079.0
1530,SCHQ,Schwab Long-Term U.S. Treasury ETF,Financial,Exchange Traded Fund,USA,,,47.97,-0.0025,72898.0
1531,SCHR,Schwab Intermediate-Term U.S. Treasury ETF,Financial,Exchange Traded Fund,USA,,,56.56,-0.0016,222883.0
1532,SCHV,Schwab U.S. Large-Cap Value ETF,Financial,Exchange Traded Fund,USA,,,66.53,0.0042,343041.0
1533,SCHX,Schwab U.S. Large-Cap ETF,Financial,Exchange Traded Fund,USA,,,99.89,0.0070999999999999995,581406.0
1534,SCHZ,Schwab U.S. Aggregate Bond ETF,Financial,Exchange Traded Fund,USA,,,54.1,-0.0009,799423.0
1535,SCJ,iShares MSCI Japan Small-Cap ETF,Financial,Exchange Traded Fund,USA,,,82.76,0.0058,3727.0
1536,SCO,ProShares UltraShort Bloomberg Crude Oil,Financial,Exchange Traded Fund,USA,,,6.95,0.0043,2474829.0
1537,SCZ,iShares MSCI EAFE Small-Cap ETF,Financial,Exchange Traded Fund,USA,,,74.28,0.0023,1076829.0
1538,SDD,ProShares UltraShort SmallCap600,Financial,Exchange Traded Fund,USA,,,6.62,-0.0062,541.0
1539,SDEM,Global X MSCI SuperDividend Emerging Markets ETF,Financial,Exchange Traded Fund,USA,,,12.03,-0.005600000000000001,29487.0
1540,SDG,iShares MSCI Global Impact ETF,Financial,Exchange Traded Fund,USA,,,96.02,-0.0002,20177.0
1541,SDIV,Global X SuperDividend ETF,Financial,Exchange Traded Fund,USA,,,13.83,-0.0058,359356.0
1542,SDOG,ALPS Sector Dividend Dogs ETF,Financial,Exchange Traded Fund,USA,,,51.88,0.0034999999999999996,26532.0
1543,SDOW,ProShares UltraPro Short Dow30,Financial,Exchange Traded Fund,USA,,,9.02,-0.024900000000000002,7486106.0
1544,SDP,ProShares UltraShort Utilities,Financial,Exchange Traded Fund,USA,,,16.6,0.0008,3336.0
1545,SDS,ProShares UltraShort S&P500,Financial,Exchange Traded Fund,USA,,,9.96,-0.0158,7957453.0
1546,SDVY,First Trust SMID Cap Rising Dividend Achievers ETF,Financial,Exchange Traded Fund,USA,,,29.14,0.0062,53948.0
1547,SDY,SPDR S&P Dividend ETF,Financial,Exchange Traded Fund,USA,,,119.68,0.0045000000000000005,419422.0
1548,SECT,Main Sector Rotation ETF,Financial,Exchange Traded Fund,USA,,,39.35,0.005600000000000001,140886.0
1549,SEF,ProShares Short Financials,Financial,Exchange Traded Fund,USA,,,13.61,-0.006500000000000001,5366.0
1550,SENT,AdvisorShares Alpha DNA Equity Sentiment ETF,Financial,Exchange Traded Fund,USA,,,27.07,0.0019,25464.0
1551,SFIG,WisdomTree U.S. Short-Term Corporate Bond Fund,Financial,Exchange Traded Fund,USA,,,51.4,-0.0005,1597.0
1552,SFY,SoFi Select 500 ETF,Financial,Exchange Traded Fund,USA,,,15.03,0.006,82185.0
1553,SFYF,SoFi 50 ETF,Financial,Exchange Traded Fund,USA,,,30.49,0.0001,5152.0
1554,SFYX,SoFi Next 500 ETF,Financial,Exchange Traded Fund,USA,,,13.8,-0.0022,19996.0
1555,SGDJ,Sprott Junior Gold Miners ETF,Financial,Exchange Traded Fund,USA,,,45.1,0.0073,26910.0
1556,SGDM,Sprott Gold Miners ETF,Financial,Exchange Traded Fund,USA,,,28.81,0.0006,30823.0
1557,SGG,iPath Series B Bloomberg Sugar Subindex Total Return ETN,Financial,Exchange Traded Fund,USA,,,48.72,0.0208,3283.0
1558,SGOL,Aberdeen Standard Gold ETF Trust,Financial,Exchange Traded Fund,USA,,,16.75,-0.0070999999999999995,1043343.0
1559,SGOV,iShares 0-3 Month Treasury Bond ETF,Financial,Exchange Traded Fund,USA,,,100.02,-0.0001,13961.0
1560,SH,ProShares Short S&P500,Financial,Exchange Traded Fund,USA,,,16.14,-0.008,6080615.0
1561,SHAG,WisdomTree Yield Enhanced U.S. Short-Term Aggregate Bond Fund,Financial,Exchange Traded Fund,USA,,,51.04,-0.0008,5423.0
1562,SHE,SPDR SSGA Gender Diversity Index ETF,Financial,Exchange Traded Fund,USA,,,98.12,0.0053,7465.0
1563,SHM,SPDR Nuveen Bloomberg Barclays Short Term Municipal Bond ETF,Financial,Exchange Traded Fund,USA,,,49.59,-0.0002,1583623.0
1564,SHV,iShares Short Treasury Bond ETF,Financial,Exchange Traded Fund,USA,,,110.53,0.0001,1485202.0
1565,SHY,iShares 1-3 Year Treasury Bond ETF,Financial,Exchange Traded Fund,USA,,,86.24,-0.0003,2496227.0
1566,SHYD,VanEck Vectors Short High Yield Muni ETF,Financial,Exchange Traded Fund,USA,,,25.04,-0.0002,40516.0
1567,SHYG,iShares 0-5 Year High Yield Corporate Bond ETF,Financial,Exchange Traded Fund,USA,,,45.75,-0.0004,588902.0
1568,SHYL,Xtrackers Short Duration High Yield Bond ETF,Financial,Exchange Traded Fund,USA,,,47.85,-0.0006,11643.0
1569,SIJ,ProShares UltraShort Industrials,Financial,Exchange Traded Fund,USA,,,7.72,-0.0187,450.0
1570,SIL,Global X Silver Miners ETF,Financial,Exchange Traded Fund,USA,,,42.91,-0.0049,168540.0
1571,SILJ,ETFMG Prime Junior Silver Miners ETF,Financial,Exchange Traded Fund,USA,,,15.69,-0.0101,1479730.0
1572,SIMS,SPDR S&P Kensho Intelligent Structures ETF,Financial,Exchange Traded Fund,USA,,,46.46,0.0021,15833.0
1573,SIVR,Aberdeen Standard Physical Silver Shares ETF,Financial,Exchange Traded Fund,USA,,,24.37,-0.008100000000000001,386962.0
1574,SIXA,6 Meridian Mega Cap Equity ETF,Financial,Exchange Traded Fund,USA,,,32.55,0.006500000000000001,4359.0
1575,SIXH,6 Meridian Hedged Equity-Index Option Strategy ETF,Financial,Exchange Traded Fund,USA,,,28.74,0.0023,3036.0
1576,SIXL,6 Meridian Low Beta Equity Strategy ETF,Financial,Exchange Traded Fund,USA,,,33.33,0.002,3686.0
1577,SIXS,6 Meridian Small Cap Equity ETF,Financial,Exchange Traded Fund,USA,,,46.31,0.0048,4444.0
1578,SIZE,iShares MSCI USA Size Factor ETF,Financial,Exchange Traded Fund,USA,,,123.1,0.0049,24033.0
1579,SJB,ProShares Short High Yield,Financial,Exchange Traded Fund,USA,,,18.38,0.0008,19209.0
1580,SJNK,SPDR Bloomberg Barclays Short Term High Yield Bond ETF,Financial,Exchange Traded Fund,USA,,,27.31,-0.0007000000000000001,3428445.0
1581,SKF,ProShares UltraShort Financials,Financial,Exchange Traded Fund,USA,,,11.42,-0.013000000000000001,15937.0
1582,SKOR,FlexShares Credit-Scored US Corporate Bond Index Fund,Financial,Exchange Traded Fund,USA,,,53.65,-0.0007000000000000001,10669.0
1583,SKYU,ProShares Ultra Cloud Computing,Financial,Exchange Traded Fund,USA,,,41.55,0.0075,950.0
1584,SKYY,First Trust Cloud Computing ETF,Financial,Exchange Traded Fund,USA,,,100.57,0.0038,166422.0
1585,SLQD,iShares 0-5 Year Investment Grade Corporate Bond ETF,Financial,Exchange Traded Fund,USA,,,51.79,-0.0004,216277.0
1586,SLV,iShares Silver Trust,Financial,Exchange Traded Fund,USA,,,23.41,-0.0089,15681378.0
1587,SLVO,Credit Suisse X-Links Silver Shares Covered Call ETN,Financial,Exchange Traded Fund,USA,,,6.32,-0.0032,749799.0
1588,SLVP,iShares MSCI Global Silver and Metals Miners ETF,Financial,Exchange Traded Fund,USA,,,15.98,-0.0111,152919.0
1589,SLX,VanEck Vectors Steel ETF,Financial,Exchange Traded Fund,USA,,,55.78,-0.011899999999999999,56931.0
1590,SLY,SPDR S&P 600 Small Cap ETF,Financial,Exchange Traded Fund,USA,,,94.9,0.0029,35225.0
1591,SLYG,SPDR S&P 600 Small Cap Growth ETF,Financial,Exchange Traded Fund,USA,,,86.88,0.0009,52875.0
1592,SLYV,SPDR S&P 600 Small Cap Value ETF,Financial,Exchange Traded Fund,USA,,,82.59,0.0028000000000000004,253349.0
1593,SMB,VanEck Vectors Short Muni ETF,Financial,Exchange Traded Fund,USA,,,18.06,0.0017000000000000001,25225.0
1594,SMCP,AlphaMark Actively Managed Small Cap ETF,Financial,Exchange Traded Fund,USA,,,29.98,-0.008100000000000001,234.0
1595,SMDD,ProShares UltraPro Short MidCap400,Financial,Exchange Traded Fund,USA,,,7.35,-0.0161,10393.0
1596,SMDV,ProShares Russell 2000 Dividend Growers ETF,Financial,Exchange Traded Fund,USA,,,65.9,0.0033,64228.0
1597,SMH,VanEck Vectors Semiconductor ETF,Financial,Exchange Traded Fund,USA,,,256.08,-0.0023,2694029.0
1598,SMHB,ETRACS 2xMonthly Pay Leveraged US Small Cap High Dividend ETN,Financial,Exchange Traded Fund,USA,,,11.37,-0.0087,33551.0
1599,SMIN,iShares MSCI India Small-Cap ETF,Financial,Exchange Traded Fund,USA,,,49.06,0.0012,13986.0
1600,SMLF,iShares MSCI USA Small-Cap Multifactor ETF,Financial,Exchange Traded Fund,USA,,,53.55,0.004699999999999999,37860.0
1601,SMLV,SPDR SSGA US Small Cap Low Volatility Index ETF,Financial,Exchange Traded Fund,USA,,,113.03,0.0037,3309.0
1602,SMMD,iShares Russell 2500 ETF,Financial,Exchange Traded Fund,USA,,,64.11,0.0044,9934.0
1603,SMMU,PIMCO Short Term Municipal Bond Active ETF,Financial,Exchange Traded Fund,USA,,,51.4,0.0008,251029.0
1604,SMMV,iShares MSCI USA Small-Cap Min Vol Factor ETF,Financial,Exchange Traded Fund,USA,,,37.45,-0.0003,40198.0
1605,SMN,ProShares UltraShort Basic Materials,Financial,Exchange Traded Fund,USA,,,7.78,-0.011699999999999999,456.0
1606,SMOG,VanEck Vectors Low Carbon Energy ETF,Financial,Exchange Traded Fund,USA,,,155.48,-0.0038,7553.0
1607,SNLN,Highland/iBoxx Senior Loan ETF,Financial,Exchange Traded Fund,USA,,,16.2,-0.0003,12063.0
1608,SNPE,Xtrackers S&P 500 ESG ETF,Financial,Exchange Traded Fund,USA,,,36.22,0.0092,95792.0
1609,SNSR,Global X Internet of Things ETF,Financial,Exchange Traded Fund,USA,,,34.55,0.0029,54010.0
1610,SNUG,Alpha Architect Merlyn.AI Tactical Growth and Income ETF,Financial,Exchange Traded Fund,USA,,,27.56,-0.0019,407.0
1611,SOCL,Global X Social Media ETF,Financial,Exchange Traded Fund,USA,,,70.12,-0.0067,33850.0
1612,SOXL,Direxion Daily Semiconductor Bull 3X Shares,Financial,Exchange Traded Fund,USA,,,44.48,-0.0069,10683492.0
1613,SOXS,Direxion Daily Semiconductor Bear 3X Shares,Financial,Exchange Traded Fund,USA,,,8.22,0.0049,4899076.0
1614,SOXX,iShares PHLX Semiconductor ETF,Financial,Exchange Traded Fund,USA,,,446.8,-0.0031,819290.0
1615,SOYB,Teucrium Soybean,Financial,Exchange Traded Fund,USA,,,21.35,-0.0034000000000000002,96137.0
1616,SPAB,SPDR Portfolio Aggregate Bond ETF,Financial,Exchange Traded Fund,USA,,,29.72,-0.001,696865.0
1617,SPAK,Defiance Next Gen SPAC Derived ETF,Financial,Exchange Traded Fund,USA,,,26.71,-0.0019,53676.0
1618,SPBO,SPDR Portfolio Corporate Bond ETF,Financial,Exchange Traded Fund,USA,,,34.61,-0.0014000000000000002,47707.0
1619,SPCX,SPAC and New Issue ETF,Financial,Exchange Traded Fund,USA,,,28.94,0.0028000000000000004,51814.0
1620,SPDN,Direxion Daily S&P 500 Bear 1X Shares,Financial,Exchange Traded Fund,USA,,,16.57,-0.0084,935308.0
1621,SPDV,AAM S&P 500 High Dividend Value ETF,Financial,Exchange Traded Fund,USA,,,29.36,0.0043,6833.0
1622,SPDW,SPDR Portfolio Developed World ex-US ETF,Financial,Exchange Traded Fund,USA,,,36.39,0.0025,988987.0
1623,SPEM,SPDR Portfolio Emerging Markets ETF,Financial,Exchange Traded Fund,USA,,,43.93,-0.0077,676373.0
1624,SPEU,SPDR Portfolio Europe ETF,Financial,Exchange Traded Fund,USA,,,40.54,-0.0004,6913.0
1625,SPFF,Global X SuperIncome Preferred ETF,Financial,Exchange Traded Fund,USA,,,11.95,0.0013,81077.0
1626,SPGM,SPDR Portfolio MSCI Global Stock Market ETF,Financial,Exchange Traded Fund,USA,,,53.89,0.003,14020.0
1627,SPGP,Invesco S&P 500 GARP ETF,Financial,Exchange Traded Fund,USA,,,83.84,0.009399999999999999,37367.0
1628,SPHB,Invesco S&P 500 High Beta ETF,Financial,Exchange Traded Fund,USA,,,71.19,0.0034000000000000002,1311649.0
1629,SPHD,Invesco S&P 500 High Dividend Low Volatility ETF,Financial,Exchange Traded Fund,USA,,,43.15,0.0014000000000000002,543487.0
1630,SPHQ,Invesco S&P 500 Quality ETF,Financial,Exchange Traded Fund,USA,,,45.8,0.0064,299300.0
1631,SPHY,SPDR Portfolio High Yield Bond ETF,Financial,Exchange Traded Fund,USA,,,26.58,-0.0004,88217.0
1632,SPIB,SPDR Portfolio Intermediate Term Corporate Bond ETF,Financial,Exchange Traded Fund,USA,,,36.34,-0.0008,3004933.0
1633,SPIP,SPDR Portfolio TIPS ETF,Financial,Exchange Traded Fund,USA,,,30.44,-0.0029,485635.0
1634,SPLB,SPDR Portfolio Long Term Corporate Bond ETF,Financial,Exchange Traded Fund,USA,,,30.48,-0.0023,2431808.0
1635,SPLG,SPDR Portfolio S&P 500 ETF,Financial,Exchange Traded Fund,USA,,,48.38,0.0073,2196725.0
1636,SPLV,Invesco S&P 500 Low Volatility ETF,Financial,Exchange Traded Fund,USA,,,59.19,0.0039000000000000003,1494142.0
1637,SPMB,SPDR Portfolio Mortgage Backed Bond ETF,Financial,Exchange Traded Fund,USA,,,25.95,0.0,614838.0
1638,SPMD,SPDR Portfolio S&P 400 Mid Cap ETF,Financial,Exchange Traded Fund,USA,,,46.8,0.0045000000000000005,618857.0
1639,SPMO,Invesco S&P 500 Momentum ETF,Financial,Exchange Traded Fund,USA,,,55.83,0.01,7864.0
1640,SPSB,SPDR Portfolio Short Term Corporate Bond ETF,Financial,Exchange Traded Fund,USA,,,31.31,0.0006,1427077.0
1641,SPSK,SP Funds Dow Jones Global Sukuk ETF,Financial,Exchange Traded Fund,USA,,,19.99,-0.003,11847.0
1642,SPSM,SPDR Portfolio S&P 600 Small Cap ETF,Financial,Exchange Traded Fund,USA,,,42.65,0.0012,231496.0
1643,SPTI,SPDR Portfolio Intermediate Term Treasury ETF,Financial,Exchange Traded Fund,USA,,,32.18,-0.0016,486776.0
1644,SPTL,SPDR Portfolio Long Term Treasury ETF,Financial,Exchange Traded Fund,USA,,,39.49,-0.0033,1750837.0
1645,SPTM,SPDR Portfolio S&P 1500 Composite Stock Market ETF,Financial,Exchange Traded Fund,USA,,,50.97,0.0069,278066.0
1646,SPTS,SPDR Portfolio Short Term Treasury ETF,Financial,Exchange Traded Fund,USA,,,30.66,-0.0003,950901.0
1647,SPUS,SP Funds S&P 500 Sharia Industry Exclusions ETF,Financial,Exchange Traded Fund,USA,,,27.38,0.0077,24509.0
1648,SPUU,Direxion Daily S&P 500 Bull 2X Shares,Financial,Exchange Traded Fund,USA,,,90.07,0.0155,5656.0
1649,SPVM,Invesco S&P 500 Value with Momentum ETF,Financial,Exchange Traded Fund,USA,,,47.33,0.0089,7051.0
1650,SPVU,Invesco S&P 500 Enhanced Value ETF,Financial,Exchange Traded Fund,USA,,,40.46,0.0063,4983.0
1651,SPXB,ProShares S&P 500 Bond ETF,Financial,Exchange Traded Fund,USA,,,89.76,-0.0003,927.0
1652,SPXE,ProShares S&P 500 ex-Energy ETF,Financial,Exchange Traded Fund,USA,,,89.63,0.0097,2586.0
1653,SPXL,Direxion Daily S&P500 Bull 3X Shares,Financial,Exchange Traded Fund,USA,,,94.81,0.021400000000000002,4800201.0
1654,SPXS,Direxion Daily S&P 500 Bear 3X Shares,Financial,Exchange Traded Fund,USA,,,27.94,-0.021400000000000002,7076604.0
1655,SPXT,ProShares S&P 500 ex-Technology ETF,Financial,Exchange Traded Fund,USA,,,71.11,0.0066,23.0
1656,SPXU,ProShares UltraPro Short S&P500,Financial,Exchange Traded Fund,USA,,,21.09,-0.0218,5030014.0
1657,SPXZ,Morgan Creek - Exos SPAC Originated ETF,Financial,Exchange Traded Fund,USA,,,21.12,-0.0066,32778.0
1658,SPY,SPDR S&P 500 ETF Trust,Financial,Exchange Traded Fund,USA,,,411.49,0.0073,60857856.0
1659,SPYD,SPDR Portfolio S&P 500 High Dividend ETF,Financial,Exchange Traded Fund,USA,,,38.97,0.0028000000000000004,1132031.0
1660,SPYG,SPDR Portfolio S&P 500 Growth ETF,Financial,Exchange Traded Fund,USA,,,59.62,0.009000000000000001,1232211.0
1661,SPYV,SPDR Portfolio S&P 500 Value ETF,Financial,Exchange Traded Fund,USA,,,38.62,0.0055000000000000005,3637366.0
1662,SPYX,SPDR S&P 500 Fossil Fuel Reserves Free ETF,Financial,Exchange Traded Fund,USA,,,102.04,0.0074,294494.0
