,Date,Title,Link,Ticker
0,2021-03-31 07:05:00,Are Institutions Heavily Invested In NVE Corporation's (NASDAQ:NVEC) Shares?,https://finance.yahoo.com/news/institutions-heavily-invested-nve-corporations-110544169.html,NVEC
1,2021-02-23 04:12:00,Should We Be Excited About The Trends Of Returns At NVE (NASDAQ:NVEC)?,https://finance.yahoo.com/news/excited-trends-returns-nve-nasdaq-091244130.html,NVEC
2,2021-01-24 03:09:00,Don't Race Out To Buy NVE Corporation (NASDAQ:NVEC) Just Because It's Going Ex-Dividend,https://finance.yahoo.com/news/dont-race-buy-nve-corporation-080918104.html,NVEC
3,2021-01-20 16:05:00,NVE Corporation Reports Third Quarter Results and Announces Quarterly Dividend,https://finance.yahoo.com/news/nve-corporation-reports-third-quarter-210500775.html,NVEC
4,2020-12-25 03:27:00,Why NVE's (NASDAQ:NVEC) CEO Pay Matters,https://finance.yahoo.com/news/why-nves-nasdaq-nvec-ceo-082747175.html,NVEC
5,2020-12-10 21:10:00,Is NVEC A Good Stock To Buy Now?,https://finance.yahoo.com/news/nvec-good-stock-buy-now-021026583.html,NVEC
6,2020-11-25 02:48:00,NVE's (NASDAQ:NVEC) Shareholders Are Down 38% On Their Shares,https://finance.yahoo.com/news/nves-nasdaq-nvec-shareholders-down-074853799.html,NVEC
7,2020-10-26 06:57:00,Dividend Investors: Don't Be Too Quick To Buy NVE Corporation (NASDAQ:NVEC) For Its Upcoming Dividend,https://finance.yahoo.com/news/dividend-investors-dont-too-quick-105700532.html,NVEC
8,2020-10-23 15:00:00,25 Top-Paying Dividend Stocks That Will Make You Rich,https://finance.yahoo.com/news/10-highest-paying-dividend-stocks-100035310.html,NVEC
9,2020-10-21 16:05:00,NVE Corporation Reports Second Quarter Results and Announces Quarterly Dividend,https://finance.yahoo.com/news/nve-corporation-reports-second-quarter-200500782.html,NVEC
10,2020-10-12 16:05:00,NVE Schedules Conference Call on Second-Quarter Results,https://finance.yahoo.com/news/nve-schedules-conference-call-second-200500753.html,NVEC
11,2020-10-01 11:31:00,What Kind Of Investors Own Most Of NVE Corporation (NASDAQ:NVEC)?,https://finance.yahoo.com/news/kind-investors-own-most-nve-153119027.html,NVEC
12,2020-09-04 12:58:00,Our Take On The Returns On Capital At NVE (NASDAQ:NVEC),https://finance.yahoo.com/news/returns-capital-nve-nasdaq-nvec-165830658.html,NVEC
13,2020-08-05 13:58:00,Does The Market Have A Low Tolerance For NVE Corporation's (NASDAQ:NVEC) Mixed Fundamentals?,https://finance.yahoo.com/news/does-market-low-tolerance-nve-175836896.html,NVEC
14,2020-07-22 16:05:00,NVE Corporation Reports First Quarter Results and Announces Quarterly Dividend,https://finance.yahoo.com/news/nve-corporation-reports-first-quarter-200500887.html,NVEC
15,2020-07-13 16:05:00,NVE Schedules Conference Call on First-Quarter Results,https://finance.yahoo.com/news/nve-schedules-conference-call-first-200500711.html,NVEC
16,2020-06-25 17:50:00,Hedge Funds Are Dumping NVE Corporation (NVEC),https://finance.yahoo.com/news/hedge-funds-dumping-nve-corporation-215010766.html,NVEC
17,2020-06-11 19:58:00,Edited Transcript of NVEC earnings conference call or presentation 6-May-20 9:00pm GMT,https://finance.yahoo.com/news/edited-transcript-nvec-earnings-conference-235848588.html,NVEC
18,2020-05-06 16:05:00,NVE Corporation Reports Fourth Quarter and Fiscal Year Results and Announces Quarterly Dividend,https://finance.yahoo.com/news/nve-corporation-reports-fourth-quarter-200510214.html,NVEC
19,2020-05-06 08:37:00,Did Changing Sentiment Drive NVE's (NASDAQ:NVEC) Share Price Down By 37%?,https://finance.yahoo.com/news/did-changing-sentiment-drive-nves-123707763.html,NVEC
20,2020-04-27 16:05:00,NVE Schedules Conference Call on Fourth-Quarter and Fiscal Year Results,https://finance.yahoo.com/news/nve-schedules-conference-call-fourth-200510061.html,NVEC
21,2020-04-13 12:14:00,Calculating The Fair Value Of NVE Corporation (NASDAQ:NVEC),https://finance.yahoo.com/news/calculating-fair-value-nve-corporation-161421788.html,NVEC
22,2020-03-17 08:33:00,What Is NVE's (NASDAQ:NVEC) P/E Ratio After Its Share Price Tanked?,https://finance.yahoo.com/news/nves-nasdaq-nvec-p-e-123321514.html,NVEC
23,2020-03-09 15:09:00,Something To Consider Before Buying NVE Corporation (NASDAQ:NVEC) For The 6.5% Dividend,https://finance.yahoo.com/news/something-consider-buying-nve-corporation-190935964.html,NVEC
24,2020-02-11 09:09:00,Is NVE Corporation's (NASDAQ:NVEC) P/E Ratio Really That Good?,https://finance.yahoo.com/news/nve-corporations-nasdaq-nvec-p-140939123.html,NVEC
25,2020-01-23 21:36:00,Edited Transcript of NVEC earnings conference call or presentation 22-Jan-20 10:00pm GMT,https://finance.yahoo.com/news/edited-transcript-nvec-earnings-conference-081342670.html,NVEC
26,2020-01-22 16:05:00,NVE Corporation Reports Third Quarter Results and Announces Quarterly Dividend,https://finance.yahoo.com/news/nve-corporation-reports-third-quarter-210510502.html,NVEC
27,2020-01-14 09:54:00,Does Market Volatility Impact NVE Corporation's (NASDAQ:NVEC) Share Price?,https://finance.yahoo.com/news/does-market-volatility-impact-nve-145401491.html,NVEC
28,2020-01-13 16:05:00,NVE Corporation Schedules Conference Call on Third-Quarter Results,https://finance.yahoo.com/news/nve-corporation-schedules-conference-call-210510668.html,NVEC
29,2019-12-16 09:15:00,NVE Corporation (NASDAQ:NVEC) Is Employing Capital Very Effectively,https://finance.yahoo.com/news/nve-corporation-nasdaq-nvec-employing-141519310.html,NVEC
30,2019-12-14 19:48:00,Hedge Funds Have Never Been This Bullish On NVE Corporation (NVEC),https://finance.yahoo.com/news/hedge-funds-never-bullish-nve-004805350.html,NVEC
31,2019-11-19 08:26:00,Should You Worry About NVE Corporation's (NASDAQ:NVEC) CEO Salary Level?,https://finance.yahoo.com/news/worry-nve-corporations-nasdaq-nvec-132626365.html,NVEC
32,2019-11-07 18:08:00,Hedge Funds Have Never Been More Bullish On NVE Corporation (NVEC),https://finance.yahoo.com/news/hedge-funds-never-more-bullish-230836890.html,NVEC
33,2019-10-30 16:40:00,Edited Transcript of NVEC earnings conference call or presentation 23-Oct-19 9:00pm GMT,https://finance.yahoo.com/news/edited-transcript-nvec-earnings-conference-220039261.html,NVEC
34,2019-10-27 08:06:00,We Wouldn't Be Too Quick To Buy NVE Corporation (NASDAQ:NVEC) Before It Goes Ex-Dividend,https://finance.yahoo.com/news/wouldnt-too-quick-buy-nve-120630968.html,NVEC
35,2019-10-23 16:05:00,NVE Corporation Reports Second Quarter Results and Announces Quarterly Dividend,https://finance.yahoo.com/news/nve-corporation-reports-second-quarter-200505506.html,NVEC
36,2019-10-14 16:05:00,NVE Schedules Conference Call on Second-Quarter Results,https://finance.yahoo.com/news/nve-schedules-conference-call-second-200500685.html,NVEC
37,2019-10-08 11:53:00,Do Directors Own NVE Corporation (NASDAQ:NVEC) Shares?,https://finance.yahoo.com/news/directors-own-nve-corporation-nasdaq-155305165.html,NVEC
38,2019-09-17 07:55:00,"If You Had Bought NVE (NASDAQ:NVEC) Stock A Year Ago, You'd Be Sitting On A 36% Loss, Today",https://finance.yahoo.com/news/had-bought-nve-nasdaq-nvec-115518740.html,NVEC
39,2019-08-28 06:15:00,Does NVE Corporation (NASDAQ:NVEC) Have A Place In Your Dividend Stock Portfolio?,https://finance.yahoo.com/news/does-nve-corporation-nasdaq-nvec-101501956.html,NVEC
40,2019-08-08 06:39:00,Here's How P/E Ratios Can Help Us Understand NVE Corporation (NASDAQ:NVEC),https://finance.yahoo.com/news/heres-p-e-ratios-help-103931504.html,NVEC
41,2019-07-25 18:25:00,Edited Transcript of NVEC earnings conference call or presentation 17-Jul-19 9:00pm GMT,https://finance.yahoo.com/news/edited-transcript-nvec-earnings-conference-024205613.html,NVEC
42,2019-07-18 02:23:00,NVE (NVEC) Q1 2020 Earnings Call Transcript,https://finance.yahoo.com/news/nve-nvec-q1-2020-earnings-062338199.html,NVEC
43,2019-07-17 16:05:00,NVE Corporation Reports First Quarter Results and Announces Quarterly Dividend,https://finance.yahoo.com/news/nve-corporation-reports-first-quarter-200500436.html,NVEC
44,2019-07-08 16:05:00,NVE Corporation Schedules Conference Call on First-Quarter Results,https://finance.yahoo.com/news/nve-corporation-schedules-conference-call-200500429.html,NVEC
45,2019-07-03 05:59:00,Is NVE Corporation (NASDAQ:NVEC) A High Quality Stock To Own?,https://finance.yahoo.com/news/nve-corporation-nasdaq-nvec-high-095906334.html,NVEC
46,2019-06-17 09:04:00,I Built A List Of Growing Companies And NVE (NASDAQ:NVEC) Made The Cut,https://finance.yahoo.com/news/built-list-growing-companies-nve-130431362.html,NVEC
47,2019-05-08 10:03:00,NVE Corporation (NASDAQ:NVEC): Ex-Dividend Is In 1 Days,https://finance.yahoo.com/news/nve-corporation-nasdaq-nvec-ex-140355535.html,NVEC
48,2019-05-07 03:11:00,Edited Transcript of NVEC earnings conference call or presentation 1-May-19 9:00pm GMT,https://finance.yahoo.com/news/edited-transcript-nvec-earnings-conference-125418936.html,NVEC
49,2019-05-02 12:23:00,NVE (NVEC) Q4 2019 Earnings Call Transcript,https://finance.yahoo.com/news/nve-nvec-q4-2019-earnings-162331263.html,NVEC
50,2019-05-01 18:45:00,NVE: Fiscal 4Q Earnings Snapshot,https://finance.yahoo.com/news/nve-fiscal-4q-earnings-snapshot-224544747.html,NVEC
51,2019-05-01 16:05:00,NVE Corporation Reports Fourth Quarter and Fiscal Year Results and Announces Quarterly Dividend,https://finance.yahoo.com/news/nve-corporation-reports-fourth-quarter-200500559.html,NVEC
52,2019-04-22 16:05:00,NVE Schedules Conference Call on Fourth-Quarter and Fiscal Year Results,https://finance.yahoo.com/news/nve-schedules-conference-call-fourth-200500512.html,NVEC
53,2019-04-20 09:33:00,Should You Like NVE Corporations (NASDAQ:NVEC) High Return On Capital Employed?,https://finance.yahoo.com/news/nve-corporation-nasdaq-nvec-high-133332672.html,NVEC
54,2019-04-01 08:15:00,Norway identifies 13 preferred areas for new wind power projects,https://finance.yahoo.com/news/norway-identifies-13-preferred-areas-121552869.html,NVEC
55,2019-03-18 12:09:00,The NVE (NASDAQ:NVEC) Share Price Has Gained 75% And Shareholders Are Hoping For More,https://finance.yahoo.com/news/nve-nasdaq-nvec-share-price-160910476.html,NVEC
56,2019-02-27 07:30:00,"Market Trends Toward New Normal in Guidewire Software, UGI, Thor Industries, Dover, Snap-On, and NVE  Emerging Consolidated Expectations, Analyst Ratings",https://finance.yahoo.com/news/market-trends-toward-normal-guidewire-123000296.html,NVEC
57,2019-02-25 09:50:00,Should We Worry About NVE Corporations (NASDAQ:NVEC) P/E Ratio?,https://finance.yahoo.com/news/worry-nve-corporation-nasdaq-nvec-145028747.html,NVEC
58,2019-02-07 09:37:00,Read This Before Buying NVE Corporation (NASDAQ:NVEC) Shares,https://finance.yahoo.com/news/read-buying-nve-corporation-nasdaq-143739874.html,NVEC
59,2019-02-04 13:00:00,Edited Transcript of NVEC earnings conference call or presentation 23-Jan-19 10:00pm GMT,https://finance.yahoo.com/news/edited-transcript-nvec-earnings-conference-011457222.html,NVEC
60,2019-01-23 20:55:00,NVE Corp (NVEC) Q3 2019 Earnings Conference Call Transcript,https://finance.yahoo.com/news/nve-corp-nvec-q3-2019-015511165.html,NVEC
61,2019-01-23 16:19:00,NVE: Fiscal 3Q Earnings Snapshot,https://finance.yahoo.com/news/nve-fiscal-3q-earnings-snapshot-211932259.html,NVEC
62,2019-01-23 16:05:00,NVE Corporation Reports Third Quarter Results and Announces Quarterly Dividend,https://finance.yahoo.com/news/nve-corporation-reports-third-quarter-210500045.html,NVEC
63,2019-01-20 09:22:00,What NVE Corporations (NASDAQ:NVEC) ROE Can Tell Us,https://finance.yahoo.com/news/nve-corporation-nasdaq-nvec-roe-142218921.html,NVEC
64,2019-01-14 16:05:00,NVE Corporation Schedules Conference Call on Third-Quarter Results,https://finance.yahoo.com/news/nve-corporation-schedules-conference-call-210500836.html,NVEC
65,2019-01-01 14:42:00,What Kind Of Shareholder Appears On The NVE Corporations (NASDAQ:NVEC) Shareholder Register?,https://finance.yahoo.com/news/kind-shareholder-appears-nve-corporation-194230982.html,NVEC
66,2018-12-18 11:17:00,Hedge Funds Are Crazy About NVE Corporation (NVEC),https://finance.yahoo.com/news/hedge-funds-crazy-nve-corporation-161736790.html,NVEC
67,2018-12-10 09:09:00,Should You Worry About NVE Corporations (NASDAQ:NVEC) CEO Salary Level?,https://finance.yahoo.com/news/worry-nve-corporation-nasdaq-nvec-140944828.html,NVEC
68,2018-11-17 08:56:00,Does NVE Corporation (NASDAQ:NVEC) Have A High Beta?,https://finance.yahoo.com/news/does-nve-corporation-nasdaq-nvec-135612706.html,NVEC
69,2018-11-07 16:05:00,NVE Corporation Awarded IATF 16949 Letter of Conformance,https://finance.yahoo.com/news/nve-corporation-awarded-iatf-16949-210500278.html,NVEC
70,2018-10-25 14:52:00,Has NVE Corporation (NASDAQ:NVEC) Improved Earnings Growth In Recent Times?,https://finance.yahoo.com/news/nve-corporation-nasdaq-nvec-improved-185214047.html,NVEC
71,2018-10-25 07:20:00,"Investor Expectations to Drive Momentum within Tribune Media, Intra-Cellular Therapies, Icahn Enterprises, NVE, PetMed Express, and United Fire Group  Discovering Underlying Factors of Influence",https://finance.yahoo.com/news/investor-expectations-drive-momentum-within-112000239.html,NVEC
72,2018-10-18 23:43:00,Edited Transcript of NVEC earnings conference call or presentation 17-Oct-18 9:00pm GMT,https://finance.yahoo.com/news/edited-transcript-nvec-earnings-conference-012731354.html,NVEC
73,2018-10-15 13:29:00,NVE: Fiscal 2Q Earnings Snapshot,https://finance.yahoo.com/news/nve-fiscal-2q-earnings-snapshot-172936199.html,NVEC
74,2018-10-15 13:14:00,NVE Corporation Reports Second Quarter Results and Announces Quarterly Dividend,https://finance.yahoo.com/news/nve-corporation-reports-second-quarter-171439421.html,NVEC
75,2018-10-08 16:05:00,NVE Schedules Conference Call on Second-Quarter Results,https://finance.yahoo.com/news/nve-schedules-conference-call-second-200500057.html,NVEC
76,2018-10-02 12:55:00,Is NVE Corporations (NASDAQ:NVEC) Balance Sheet Strong Enough To Weather A Storm?,https://finance.yahoo.com/news/nve-corporation-nasdaq-nvec-balance-165554994.html,NVEC
77,2018-09-05 07:55:00,"New Research: Key Drivers of Growth for Intra-Cellular Therapies, The, Bassett Furniture Industries, NVE, Equity Bancshares, and Cable One  Factors of Influence, Major Initiatives and Sustained Production",https://finance.yahoo.com/news/research-key-drivers-growth-intra-115500302.html,NVEC
78,2018-09-02 09:58:00,Is NVE Corporation (NASDAQ:NVEC) Attractive At Its Current PE Ratio?,https://finance.yahoo.com/news/nve-corporation-nasdaq-nvec-attractive-135847704.html,NVEC
79,2018-08-15 08:30:00,"Report: Developing Opportunities within The Providence Service, NVE, StoneMor Partners, Midland States, Destination XL Group, and Catalyst Biosciences  Future Expectations, Projections Moving into 2018",https://finance.yahoo.com/news/report-developing-opportunities-within-providence-123000905.html,NVEC
80,2018-07-20 15:01:00,NVE (NVEC) Q1 2019 Earnings Conference Call Transcript,https://finance.yahoo.com/news/nve-nvec-q1-2019-earnings-190104126.html,NVEC
81,2018-07-20 08:53:00,Edited Transcript of NVEC earnings conference call or presentation 18-Jul-18 9:00pm GMT,https://finance.yahoo.com/news/edited-transcript-nvec-earnings-conference-125308598.html,NVEC
82,2018-07-18 16:34:00,NVE: Fiscal 1Q Earnings Snapshot,https://finance.yahoo.com/news/nve-fiscal-1q-earnings-snapshot-203453951.html,NVEC
83,2018-07-18 16:05:00,NVE Corporation Reports First Quarter Results and Announces Quarterly Dividend,https://finance.yahoo.com/news/nve-corporation-reports-first-quarter-200500560.html,NVEC
84,2018-07-09 16:05:00,NVE Schedules Conference Call on First-Quarter Results,https://finance.yahoo.com/news/nve-schedules-conference-call-first-200500374.html,NVEC
85,2018-07-02 11:11:00,Norway adopts new power grid regime from 2019,https://finance.yahoo.com/news/norway-adopts-power-grid-regime-151108796.html,NVEC
86,2018-06-27 07:51:00,What You Must Know About NVE Corporations (NASDAQ:NVEC) ROE,https://finance.yahoo.com/news/must-know-nve-corporation-nasdaq-115118864.html,NVEC
87,2018-05-15 11:42:00,Edited Transcript of NVEC earnings conference call or presentation 2-May-18 9:00pm GMT,https://finance.yahoo.com/news/edited-transcript-nvec-earnings-conference-013547457.html,NVEC
88,2018-05-03 16:01:00,NVE: Fiscal 4Q Earnings Snapshot,https://finance.yahoo.com/news/nve-fiscal-4q-earnings-snapshot-200155914.html,NVEC
89,2018-05-02 16:05:00,NVE Corporation Reports Fourth Quarter and Fiscal Year Results and Announces Quarterly Dividend,https://finance.yahoo.com/news/nve-corporation-reports-fourth-quarter-200500895.html,NVEC
90,2018-04-02 08:15:00,"Recent Analysis Shows Jack Henry & Associates, Omnicell, Surgery Partners, Floor & Decor, NVE, and RA PHARMCTL INC Market Influences  Renewed Outlook, Key Drivers of Growth",https://finance.yahoo.com/news/recent-analysis-shows-jack-henry-121500673.html,NVEC
91,2018-01-31 08:15:00,"New Research: Key Drivers of Growth for Preferred Bank, NVE, CSW Industrials, Hi-Crush Partners LP, General Dynamics, and Denbury Resources  Factors of Influence, Major Initiatives and Sustained Production",https://finance.yahoo.com/news/research-key-drivers-growth-preferred-131500700.html,NVEC
92,2018-01-26 07:20:00,Wired News  SPI Energy Signs Strategic Agreement With COOIX,https://finance.yahoo.com/news/wired-news-spi-energy-signs-122000794.html,NVEC
93,2018-01-19 09:50:00,NVE (NVEC) Beat Q3 Earnings Estimates on Lower Expenses,https://finance.yahoo.com/news/nve-nvec-beat-q3-earnings-145002006.html,NVEC
94,2018-01-18 12:32:00,Edited Transcript of NVEC earnings conference call or presentation 17-Jan-18 10:00pm GMT,https://finance.yahoo.com/news/edited-transcript-nvec-earnings-conference-071614750.html,NVEC
95,2018-01-17 16:29:00,NVE posts 3Q profit,https://finance.yahoo.com/news/nve-posts-3q-profit-212913760.html,NVEC
96,2018-01-17 16:05:00,NVE Corporation Reports Third Quarter Results and Announces Quarterly Dividend,https://finance.yahoo.com/news/nve-corporation-reports-third-quarter-210500877.html,NVEC
97,2018-01-08 16:05:00,NVE Corporation Schedules Conference Call on Third-Quarter Results,https://finance.yahoo.com/news/nve-corporation-schedules-conference-call-210500393.html,NVEC
98,2017-12-21 11:40:00,"ETFs with exposure to NVE Corp. : December 21, 2017",http://www.capitalcube.com/blog/index.php/etfs-with-exposure-to-nve-corp-december-21-2017/,NVEC
99,2017-12-20 07:31:00,"NVE Corp. is trading above its 50 day moving average : NVEC-US : December 20, 2017",http://www.capitalcube.com/blog/index.php/nve-corp-is-trading-above-its-50-day-moving-average-nvec-us-december-20-2017/,NVEC
